{
  "$schema": "https://json-schema.org/draft/2020-12/schema",
  "$id": "https://github.com/xPAlien/pre_ship_checklist_skill/skills/ship/templates/ship-report.schema.json",
  "title": "Ship release report",
  "description": "Machine-readable Ship release decision record. scripts/report.py enforces this structure plus the cross-field release policy, which JSON Schema alone does not express.",
  "type": "object",
  "required": ["schema_version", "project", "generated_utc", "mode", "revision", "target", "verdict", "approval", "production_action_performed", "gates", "findings"],
  "additionalProperties": true,
  "properties": {
    "schema_version": { "const": "1.0" },
    "project": { "type": "string", "minLength": 1 },
    "generated_utc": { "type": "string", "pattern": "^\\d{4}-\\d{2}-\\d{2}T\\d{2}:\\d{2}(:\\d{2}(\\.\\d+)?)?(Z|[+-]\\d{2}:\\d{2})$" },
    "mode": { "enum": ["audit", "fix", "release"] },
    "revision": {
      "type": "object",
      "required": ["sha"],
      "properties": {
        "sha": { "type": "string", "pattern": "^([0-9a-f]{40}|[0-9a-f]{64})$" },
        "branch": { "type": "string" },
        "dirty": { "type": "boolean" }
      }
    },
    "target": {
      "type": "object",
      "required": ["provider", "environment"],
      "properties": {
        "provider": { "type": "string", "minLength": 1 },
        "environment": { "type": "string", "minLength": 1 },
        "domain": { "type": "string" },
        "project_id": { "type": "string" },
        "deployment_id": { "type": "string" }
      }
    },
    "verdict": { "enum": ["GO", "CONDITIONAL GO", "NO-GO"] },
    "release_owner": { "type": ["string", "null"] },
    "approval": {
      "type": "object",
      "required": ["status"],
      "properties": {
        "status": { "enum": ["NOT REQUESTED", "PENDING", "AUTHORIZED FOR SPECIFIC ACTION"] },
        "action": { "type": "string" },
        "approver": { "type": "string" },
        "record": { "type": "string" }
      }
    },
    "production_action_performed": { "type": "boolean" },
    "profile": {
      "type": "object",
      "properties": {
        "application_type": { "type": "string" },
        "audience": { "type": "string" },
        "applicable": { "type": "array", "items": { "type": "string" } },
        "not_applicable": {
          "type": "array",
          "items": {
            "type": "object",
            "required": ["category", "reason"],
            "properties": { "category": { "type": "string" }, "reason": { "type": "string", "minLength": 1 } }
          }
        }
      }
    },
    "gates": {
      "type": "object",
      "required": ["G0", "G1", "G2", "G3", "G4", "G5", "G6", "G7"],
      "additionalProperties": false,
      "patternProperties": {
        "^G[0-7]$": {
          "type": "object",
          "required": ["pass", "fail", "needs_verification", "not_applicable", "decision", "critical"],
          "properties": {
            "pass": { "type": "integer", "minimum": 0 },
            "fail": { "type": "integer", "minimum": 0 },
            "needs_verification": { "type": "integer", "minimum": 0 },
            "not_applicable": { "type": "integer", "minimum": 0 },
            "decision": { "enum": ["PASS", "FAIL", "NEEDS VERIFICATION", "NOT APPLICABLE"] },
            "critical": { "type": "boolean" }
          }
        }
      }
    },
    "findings": {
      "type": "array",
      "items": {
        "type": "object",
        "required": ["id", "controls", "severity", "status", "critical", "title", "evidence", "fix", "owner"],
        "properties": {
          "id": { "type": "string", "minLength": 1 },
          "controls": { "type": "array", "minItems": 1, "items": { "type": "string", "pattern": "^(G[0-7]-\\d{2}|BE-\\d{2}|PL-\\d{2}|SEC-\\d{2}|V\\d)$" } },
          "severity": { "enum": ["P0", "P1", "P2", "P3"] },
          "status": { "enum": ["FAIL", "NEEDS VERIFICATION"] },
          "critical": { "type": "boolean" },
          "title": { "type": "string", "minLength": 1 },
          "impact": { "type": "string" },
          "evidence": { "type": "string", "minLength": 1 },
          "fix": { "type": "string", "minLength": 1 },
          "verification": { "type": "string" },
          "owner": { "type": "string", "minLength": 1 },
          "due": { "type": "string" },
          "accepted_by": { "type": "string" }
        }
      }
    },
    "evidence": {
      "type": "array",
      "items": {
        "type": "object",
        "required": ["check", "observation", "result", "scope", "when"],
        "properties": {
          "check": { "type": "string" },
          "observation": { "type": "string" },
          "result": { "enum": ["PASS", "FAIL", "UNKNOWN"] },
          "scope": { "type": "string" },
          "when": { "type": "string" }
        }
      }
    },
    "not_executed": {
      "type": "array",
      "items": {
        "type": "object",
        "required": ["check", "reason", "next"],
        "properties": { "check": { "type": "string" }, "reason": { "type": "string" }, "next": { "type": "string" } }
      }
    },
    "backend_coverage": {
      "type": "array",
      "items": {
        "type": "object",
        "required": ["control", "applicable", "status"],
        "properties": {
          "control": { "type": "string", "pattern": "^BE-\\d{2}$" },
          "applicable": { "enum": ["yes", "no", "unknown"] },
          "status": { "enum": ["PASS", "FAIL", "NEEDS VERIFICATION", "NOT APPLICABLE"] },
          "finding": { "type": "string" },
          "reason": { "type": "string" }
        }
      }
    },
    "owner_actions": {
      "type": "array",
      "items": {
        "type": "object",
        "required": ["control", "decision_needed", "approval"],
        "properties": {
          "control": { "type": "string" },
          "scope": { "type": "string" },
          "decision_needed": { "type": "string" },
          "approval": { "type": "string" },
          "steps": { "type": "string" }
        }
      }
    },
    "runbook": {
      "type": "object",
      "properties": {
        "release_mechanism": { "type": "string" },
        "preview_deployment": { "type": "string" },
        "last_known_good": { "type": "string" },
        "rollback": { "type": "string" },
        "rollback_triggers": { "type": "array", "items": { "type": "string" } },
        "smoke_checks": { "type": "array", "items": { "type": "string" } },
        "monitoring_window": { "type": "string" }
      }
    }
  }
}
